{
  "$schema": "./016_ENTERPRISE_RESPONSIBILITY_COMPETENCY_REGISTRY.schema.json",
  "registryId": "GAEP-REG-016",
  "version": "1.0.0",
  "schemaVersion": "1.0.0",
  "status": "candidate-unaccepted",
  "updatedAt": "2026-08-09",
  "authorityBoundary": "Role assignment, RACI, and demonstrated competence do not appoint a person or grant recommendation, acceptance, risk, implementation, repository, release, operational, assurance, or audit authority.",
  "raciLegend": {
    "R": "Responsible — performs or coordinates the bounded work.",
    "A": "Accountable — exactly one named role/body owns the bounded governed decision.",
    "C": "Consulted — provides required knowledge before the decision.",
    "I": "Informed — receives the decision and material effects."
  },
  "raciRules": [
    "Every governed decision has exactly one accountable role or explicitly named accountable governance body.",
    "Missing accountability blocks acceptance and commit for the affected decision.",
    "Product Owner is never a universal default; accountability follows the decision domain.",
    "Independent assurance cannot be performed by the same bounded actor whose work is being independently assured.",
    "RACI does not imply organizational authority or competence."
  ],
  "authorityTypes": [
    { "authorityId": "recommendation", "label": "Recommendation authority", "decisionRoleIds": ["domain-expert", "product-manager", "solution-architect"] },
    { "authorityId": "acceptance", "label": "Product/record acceptance authority", "decisionRoleIds": ["business-owner", "product-leadership", "engineering-leadership"] },
    { "authorityId": "risk-acceptance", "label": "Risk-acceptance authority", "decisionRoleIds": ["governing-body", "executive-sponsor", "business-owner"] },
    { "authorityId": "implementation", "label": "Implementation authority", "decisionRoleIds": ["engineering-leadership"] },
    { "authorityId": "repository", "label": "Repository mutation/merge authority", "decisionRoleIds": ["engineering-leadership", "platform-devops"] },
    { "authorityId": "release", "label": "Release/change authority", "decisionRoleIds": ["release-change-management"] },
    { "authorityId": "operational", "label": "Operational authority", "decisionRoleIds": ["service-management", "sre-operations", "incident-recovery-leadership"] },
    { "authorityId": "independent-assurance", "label": "Independent assurance", "decisionRoleIds": ["internal-audit-independent-assurance", "ai-evaluation-tevv"] },
    { "authorityId": "audit", "label": "Audit responsibility", "decisionRoleIds": ["internal-audit-independent-assurance"] }
  ],
  "roleArchetypes": [
    { "roleId": "governing-body", "label": "Governing body", "scope": "Sets enterprise direction and reserved decision rights.", "incompatibleWithForIndependentAssurance": ["internal-audit-independent-assurance"] },
    { "roleId": "executive-sponsor", "label": "Executive sponsor", "scope": "Sponsors bounded adoption and resolves executive dependencies.", "incompatibleWithForIndependentAssurance": ["internal-audit-independent-assurance"] },
    { "roleId": "product-leadership", "label": "Product leadership", "scope": "Owns portfolio/product policy and product-level tradeoffs.", "incompatibleWithForIndependentAssurance": ["internal-audit-independent-assurance"] },
    { "roleId": "product-manager", "label": "Product Manager", "scope": "Leads evidence-based Product discovery, outcomes, and roadmap proposals.", "incompatibleWithForIndependentAssurance": [] },
    { "roleId": "product-owner", "label": "Product Owner", "scope": "Performs legitimate team/backlog Product Owner work where the organization assigns it; not a universal governor.", "incompatibleWithForIndependentAssurance": [] },
    { "roleId": "initiative-lead", "label": "Initiative lead", "scope": "Coordinates the bounded Initiative and unresolved dependencies.", "incompatibleWithForIndependentAssurance": [] },
    { "roleId": "business-owner", "label": "Business owner", "scope": "Owns bounded business outcomes and business acceptance decisions.", "incompatibleWithForIndependentAssurance": ["internal-audit-independent-assurance"] },
    { "roleId": "domain-expert", "label": "Domain expert", "scope": "Provides domain language, rules, evidence, and challenge.", "incompatibleWithForIndependentAssurance": [] },
    { "roleId": "business-architect", "label": "Business architect", "scope": "Models capabilities, value streams, operating model, and business boundaries.", "incompatibleWithForIndependentAssurance": [] },
    { "roleId": "enterprise-architect", "label": "Enterprise architect", "scope": "Owns enterprise architecture coherence and architecture decision policy.", "incompatibleWithForIndependentAssurance": [] },
    { "roleId": "solution-architect", "label": "Solution architect", "scope": "Designs and challenges solution/integration/deployment architecture for the affected slice.", "incompatibleWithForIndependentAssurance": [] },
    { "roleId": "data-ai-architect", "label": "Data/AI architect", "scope": "Owns data and AI architecture reasoning, model/provider constraints, and lifecycle risks.", "incompatibleWithForIndependentAssurance": [] },
    { "roleId": "security-architect", "label": "Security architect", "scope": "Leads threat-informed security architecture and evidence requirements.", "incompatibleWithForIndependentAssurance": [] },
    { "roleId": "privacy-specialist", "label": "Privacy specialist", "scope": "Leads privacy impact, data-use, rights, and minimization analysis.", "incompatibleWithForIndependentAssurance": [] },
    { "roleId": "legal-regulatory-specialist", "label": "Legal/regulatory specialist", "scope": "Interprets applicable legal/regulatory obligations within authorized practice.", "incompatibleWithForIndependentAssurance": [] },
    { "roleId": "risk-compliance-specialist", "label": "Risk/compliance specialist", "scope": "Assesses applicability, control outcomes, residual risk, and compliance evidence without granting risk acceptance.", "incompatibleWithForIndependentAssurance": [] },
    { "roleId": "product-design-research", "label": "User research and Product Design", "scope": "Produces and evaluates tool-neutral Product Design and user evidence.", "incompatibleWithForIndependentAssurance": [] },
    { "roleId": "engineering-leadership", "label": "Engineering leadership", "scope": "Owns engineering execution policy, implementation authority, and technical delivery decisions.", "incompatibleWithForIndependentAssurance": ["internal-audit-independent-assurance"] },
    { "roleId": "software-engineering", "label": "Software engineering", "scope": "Implements and verifies bounded software changes under repository authority.", "incompatibleWithForIndependentAssurance": [] },
    { "roleId": "data-ai-engineering", "label": "Data/AI engineering", "scope": "Implements and evaluates bounded data/model/pipeline changes.", "incompatibleWithForIndependentAssurance": [] },
    { "roleId": "platform-devops", "label": "Platform/DevOps", "scope": "Provides environments, pipelines, platform controls, and deployment evidence.", "incompatibleWithForIndependentAssurance": [] },
    { "roleId": "quality-engineering", "label": "Quality engineering", "scope": "Defines and executes test/quality evidence and traceability.", "incompatibleWithForIndependentAssurance": [] },
    { "roleId": "ai-evaluation-tevv", "label": "AI evaluation / TEVV", "scope": "Performs AI-specific test, evaluation, verification, and validation for bounded risks.", "incompatibleWithForIndependentAssurance": ["data-ai-engineering"] },
    { "roleId": "release-change-management", "label": "Release/change management", "scope": "Owns release/change authorization and controlled deployment coordination.", "incompatibleWithForIndependentAssurance": [] },
    { "roleId": "service-management", "label": "Service management", "scope": "Owns service governance, support model, and operational acceptance.", "incompatibleWithForIndependentAssurance": [] },
    { "roleId": "sre-operations", "label": "SRE/operations", "scope": "Operates, observes, responds, recovers, and supplies operational evidence.", "incompatibleWithForIndependentAssurance": [] },
    { "roleId": "incident-recovery-leadership", "label": "Incident/recovery leadership", "scope": "Directs material incident, recovery, and continuity decisions.", "incompatibleWithForIndependentAssurance": [] },
    { "roleId": "internal-audit-independent-assurance", "label": "Internal audit or independent assurance", "scope": "Independently assesses defined evidence for a bounded scope without becoming the delivery owner.", "incompatibleWithForIndependentAssurance": ["governing-body", "executive-sponsor", "product-leadership", "business-owner", "engineering-leadership"] },
    { "roleId": "affected-user-stakeholder", "label": "Affected-user/stakeholder representative", "scope": "Provides affected-user needs, impacts, challenge, and acceptance evidence where authorized.", "incompatibleWithForIndependentAssurance": [] }
  ],
  "participationLevels": [
    { "levelId": "aware", "label": "Aware", "evidenceRequirement": "Can explain the relevant GAEP boundary and recognize when guided help is required." },
    { "levelId": "guided-contributor", "label": "Guided contributor", "evidenceRequirement": "Completes a bounded scenario with a named Practitioner observing and correcting decisions." },
    { "levelId": "practitioner", "label": "Practitioner", "evidenceRequirement": "Completes representative scenarios, handles failure/Unknown states, and produces reviewable evidence independently." },
    { "levelId": "assurer-accountable", "label": "Assurer or accountable decision-maker", "evidenceRequirement": "Demonstrates challenge, escalation, authority-bound decision documentation, and independence where applicable." },